,ENGLISH_TRANSLATION,SCORE,SENTIMENT_LABEL
1812,"ahhh, i have a milk, you have a son, so i don&#39;t get to see you like this.",0.3612,positive
1813,"no matter what anyone says about you, we don&#39;t care. you are ours, may allah deliver your movie.",0.4812,positive
1814,salo bhai plz pak ajao m india nhi aa sakht: d,0.0772,positive
1815,man ki baat,0,neutral
1816,jarut karenge karenge karenge,0,neutral
1817,come soon or i am doing my own business,0,neutral
1818,mile jab thi hum tum yum hai ya bhool gaye,0,neutral
1819,so c then c॥ c c c yar why it is not there in time.,0,neutral
1820,how can i talk to you?,0,neutral
1821,"7,600th like :)",0.6705,positive
1822,whenever you come in my day,0,neutral
1823,you just have to be more discriminating with the help you render toward other people,0.4019,positive
1824,what is the name of today&#39;s fans?,0,neutral
1825,why 3:30 pm,0,neutral
1826,"hi, why is it here?",0,neutral
1827,came to be sham today,0,neutral
1828,i am waiting for you,0,neutral
1829,"how many people protest, i will see you, that we know that salman only believes in all religions, and no one can do anything wrong.",-0.743,negative
1830,will be interested in you. delhi mant.,0.4019,positive
1831,bhaijaan i&#39;m big.,0,neutral
1832,"salman, don&#39;t you keep it everyday? ramz",0,neutral
1833,४ pum toh gaya annexation॥! :(,-0.4926,negative
1834,aslam alekum jumma mubarak ho sallu darling.,0.5859,positive
1835,"yes, that&#39;s right you can now become known as a lord of the rings",0.4019,positive
1836,"as you can see, bajrangbali will have to make a movie",0,neutral
1837,"sir i love you, only vait karange, ganapati baba jai bajrangibhai",0.6369,positive
1838,"bhai, your film&#39;s whatsapp is a wonderful one because it is a mega",0.5719,positive
1839,"you will not be able to achieve your dream since the last few days, but you are trying to be happy in two years.",0.7615,positive
1840,"it&#39;s not that i don&#39;t love you, it&#39;s that i don&#39;t love you, it&#39;s that i don&#39;t love you, it&#39;s that i don&#39;t love you, it&#39;s that i don&#39;t love you, it&#39;s that i don&#39;t love you, it&#39;s that i don&#39;t love you, it&#39;s that i don&#39;t love you, it&#39;s that i don&#39;t love you.",0.9911,positive
1841,may i become a world man,0,neutral
1842,bhai jan salam lekum is on your back,0,neutral
1843,"okman, what are you waiting for, just your true salmon khan, so how are you?",0.4215,positive
1844,i came to mumbai for 2 years to see the ghosts,0,neutral
1845,"how are you? you&#39;re so sorry, we&#39;re not there for a while, but we&#39;re both talking.",-0.0953,negative
1846,"if you want my c omponent&#39;s application, then i will give you my full version of my c omm ents of my c omm ents.",0.0772,positive
1847,do you find yourself in the best way?,0.6369,positive
1848,"mary, i am your ghost",-0.3182,negative
1849,why would you be like this,0.3612,positive
1850,i would like to ask you to come to my house on eid and have a meal and one of the most important things is your button.,0.5563,positive
1851,3:30 pm kyonhu,0,neutral
1852,"if you haven&#39;t seen your jumma mubarak or, you won&#39;t be able to watch your movie because you will like it.",0.3612,positive
1853,mary chand hurry up.,0,neutral
1854,you must be careful,0.1531,positive
1855,iht salman tum iswar flow are you we won&#39;t work in it,0,neutral
1856,yeh bhavu aap bolu,0,neutral
1857,kamal kartey hoo. jabbhi aayenge tou avaz tou hougi hi.,0,neutral
1858,"you are great,bhaijaan..love u that,love u that,love u bhailove u that,love u that,love u that,love u that,love u that,-v e r y much..",0,neutral
1859,may allah keep you happy and don&#39;t give you blockbuster movies or entertain people because we are not with you.,0.872,positive
1860,"please tell, whats the story of them big puppys ...........",0.3182,positive
1861,how did you talk to me?,0,neutral
1862,bhai justh aquar bol bol do,0,neutral
1863,oh ho kab bzeg 4 p,0,neutral
1864,talk to you soon and keep up the good content,0.4404,positive
1865,7 so you go away,0,neutral
1866,14 mn and vt krlo frnd,0,neutral
1867,bhut love khut hum apsebs and kuchhni॥,0.6369,positive
1868,"if you are not a muslim, you will not be able to keep your children.",0,neutral
1869,"sir, please make me your own body, sir",0.3182,positive
1870,will you always support human being ??,0.4696,positive
1871,हन् सल्लु भै॥ये अभिजेएत् के २ लगओ॥बक्वस् पेल् र थ उस्दिन्॥केसे दोस्त बन रखे ह जो अपसे मेलँइ।,0,neutral
1872,ओह्॥हो स c चि॥ #salman_sirbhale aap baat kare ya na kare bas 1 bar #chhattishgadiya_sable_badiya bolde॥ इ_लोवे_उ॥ i need a bus.,0,neutral
1873,you are wrong,-0.4767,negative
1874,what can you do for a living?,0,neutral
1875,"tell me the truth, whether these sub-photos etc. are correct or not",0.3182,positive
1876,i&#39;m sorry to hear that.,-0.0772,negative
1877,salman khan to liwa baat i am in love because what is my dream,0.7351,positive
1878,bhaijan,0,neutral
1879,realy what is this hosakth salman khan,0,neutral
1880,"really, don&#39;t you tell me that?",0,neutral
1881,i want to meet you once and for all,0.0772,positive
1882,where are you going to cry?,-0.4767,negative
1883,i want to talk to you once and for all.,0.0772,positive
1884,from the side,0,neutral
1885,come all closed my house,0,neutral
1886,भत् भत् तक्लिफद् कमह,0,neutral
1887,सल्मन् भै॥ he will give you life for you,0,neutral
1888,hello what man will you be able to talk to salman khan?,0,neutral
1889,berne barme mt badalin. burne llg apko vulngay,0,neutral
1890,oh salmon that,0,neutral
1891,help me help me plan that,0.6597,positive
1892,bahi main has made his own book.,0,neutral
1893,"bhai gave the ex-ommittee, so he did not listen",0,neutral
1894,"o really, maj ayeg, at 4 p.m.",0,neutral
1895,abe chirkut logo thod hav to aane do itn bheedlg krkh hlo bchch logs sbshanti se baithjo koi shorni machayeg bhai aap ek ek krke sbse milo,0,neutral
1896,"at 4 o&#39;clock, mary ollege is in mainz :(",-0.4404,negative
1897,etan intarzar: o :(,-0.4404,negative
1898,love is my salmon,0.6369,positive
1899,extreme mein,0,neutral
1900,hurry up,0,neutral
1901,kone kareag rea terea sath bt tujhseya ach dog se bratlu,0,neutral
1902,"bhai fahr khan, i am not a mineral, or he is my friend.",0.4939,positive
1903,wouldn&#39;t you welcome me?,0.4588,positive
1904,ami tomar sathe koth bolte chai bhaijan.,0,neutral
1905,mujhe apa bhout achke lagte hai bachpan se dekti aa rai hai marte damtak dekungi e am am biga. . . . om napal,0,neutral
1906,i am giving you one word. please speak with respect,0.7783,positive
1907,bhaijaan i'm eagerly waiting,0.3818,positive
1908,salmon sir ply reply..my cent my dream will cm true.. ply reply with my name,0.5859,positive
1909,how many different positions will they do for you?,0,neutral
1910,as soon as possible,0,neutral
1911,we were also disgusted,-0.5267,negative
1912,3.30 k bol th y pelwen apne,0,neutral
1913,he is not waiting for blessings,-0.431,negative
1914,intejar kab takm karenge bhl,0,neutral
1915,7 years old,0,neutral
1916,i really want to work with you in the movies.,0.1513,positive
1917,you will be overwhelmed,0.0516,positive
1918,"if you don&#39;t come back, play at 4:30 pm or 4:30 pm",0.34,positive
1919,ok bhai jaan,0.296,positive
1920,will you kill salman?,-0.6908,negative
1921,say you are #salman॥ # jum mubarak ho॥,0,neutral
1922,abe tm log jyad chapad chapd kroge to bhai jaan chale jyenge bol nsb chup chap bhaitho ekdam shanti shanti shanti ankh bnd krkno type anye c ommant sirf bhai ka dhyan lgao,0,neutral
1923,salmon sir plz 5:00 pm do dou plz 4:00 pm mein nai baat karsu gi aapse plz sir plz,0.296,positive
1924,neh sapne achcha hhe madhe sapne sapne sachteya hai,0,neutral
1925,"hey, hey, hey, hey, hey, hey, hey, hey, hey, hey, hey, hey, hey, hey",0,neutral
1926,hum bajrang bhakti k bhakt h mar jayenge lekin jhut na bolenge.,0,neutral
1927,"at 4 o&#39;clock in the morning, i went for a walk with mgf.",0,neutral
1928,"i am accustomed to being addicted to animals. even at 4 o&#39;clock, it will not be possible.",0,neutral
1929,hi salman bhai me aapko bohot bad fan hu aap me bhi baat kare kya plz,-0.2263,negative
1930,havana..feeling some,0,neutral
1931,salam of sallu bhaijan,0,neutral
1932,yes yes,0.6597,positive
1933,४ so i am not alone,0.1877,positive
1934,senda plszcz,0,neutral
1935,8 minutes लुब् उ भै जान्॥ : *,0,neutral
1936,"please tell me, i am born",0.3182,positive
1937,aaj ki pratyat pb pe salman bhaijan se tarf se,0,neutral
1938,playstation is available,0,neutral
1939,may you have a lot of fun,0.5106,positive
1940,how will you do?,0,neutral
1941,keh do tumhe ye chupu chupu,0,neutral
1942,7 mind left..waiting that..,0,neutral
1943,avo kare baat salman ki?,0,neutral
1944,abe tm log nhi manoge tikhi mirchi wal nast krong sb ko tvi theek hoge.,0,neutral
1945,ilowe u salman just please chat with me,0.3182,positive
1946,7 met or,0,neutral
1947,subki and subki are your brothers,0,neutral
1948,what are you talking about ??,0,neutral
1949,these 7 minutes are not the end. please come soon.,-0.2411,negative
1950,3:53 now,0,neutral
1951,bhai tho meating is not c oncult and c ommitment,0,neutral
1952,bhai om baje paige pari hath kroge inbox,0,neutral
1953,6 minute ago ..waiting indians super star salmon khan,0.5994,positive
1954,6 min,0,neutral
1955,come oar o o o n॥ ??,0,neutral
1956,ख हो आप्शोन c अन्त् वैत्॥ :-),0.3182,positive
1957,5 met or,0,neutral
1958,hey toe,0,neutral
1959,hum apni navmoiye bajrangi bhaijan ki dilse dou krte hai ki isal ki kuvshandar movies me samil ho bhaijan,0,neutral
1960,"hello sir, we are waiting for you",0,neutral
1961,plz slmn jr on online,0.0772,positive
1962,assalamvalekum bhaijan,0,neutral
1963,it&#39;s been 3 minutes,0,neutral
1964,help me that plan help.me,0.4019,positive
1965,"sachin salman, i am in love since day",0.6369,positive
1966,it&#39;s been 5 minutes,0,neutral
1967,ajao wi hai karte hai t o aur hum faunslok,0,neutral
1968,5 mnft lefttyhoao॥sallu,0,neutral
1969,listen to all who are brothers,0,neutral
1970,ply salmon sir,0,neutral
1971,4 minutes,0,neutral
1972,aaje sunte ho jao bhi jao :),0.4588,positive
1973,bhar do jholi meri salman bhai,0,neutral
1974,they will come together,0,neutral
1975,sallu ajmbtkiay bgairnh jnyval,0,neutral
1976,how it possible.. and see that jan,0,neutral
1977,what are you doing?,0,neutral
1978,bhai ko mer salam,0,neutral
1979,ok 5 ppe on per online,0.296,positive
1980,akbari mary dreimkoh sachs cordon,0,neutral
1981,friend mahan internet that slow .. had./.. sorry,0.4404,positive
1982,the worst is salman khanka deewan,-0.6249,negative
1983,can you speak bengali?,0,neutral
1984,"hey, bajrangbali, just get an answer today.",0,neutral
1985,"if you have any questions, please feel free to contact me.",0.6808,positive
1986,sallu bhai plz abtoh a o jani,0.0772,positive
1987,please come soon,0.3182,positive
1988,hi salman bhai e am sameer thandi hav ka jhok.,0,neutral
1989,"be aware please tell, whats the story of them big puppys .....",0.3182,positive
1990,"aaj meri admiission don&#39;t get messed up. isn&#39;t it admissible? isliye man, this is what i am. :) :) :)",0.765,positive
1991,come on,0,neutral
1992,sallu agia fbpe,0,neutral
1993,3.58.. oh can wait :),0.4588,positive
1994,"salmanji, do you like haleem?",0.3612,positive
1995,i need both of them,0,neutral
1996,where do you know?,0,neutral
1997,"my heart is for the purpose, for the purpose of our life and our family, i wish for you, there are some facts and you are always happy",0.891,positive
1998,that 2 minute,0,neutral
1999,how will you apply my brother,0,neutral
2000,aa jao napplcz,0,neutral
2001,heam ur big fag.e vn ur vatograf vid ur autografar qusntan ki han ki kar kar khir khushburti ki raj hai,0,neutral
2002,the thing is a myth or a mineral. think:,0,neutral
2003,start two friends,0.4767,positive
2004,sir 2 mints left,0,neutral
2005,5pm bj krenge direkt kat mere saat,0,neutral
2006,"please tell, whats the story of them big puppys ...........",0.3182,positive
2007,"well, we&#39;ve done it",0.2732,positive
2008,once upon a time there was a meeting between you and me,0,neutral
2009,"your letter is not written, maybe it will reach you.",0.0258,positive
2010,my blessings are with you,0.5423,positive
2011,say yes,0.4019,positive
2012,you are great,0.6249,positive
2013,"wait yes, my salman. no news came to you.",0.128,positive
2014,advnc a eid mubarak salmanbhai,0,neutral
2015,what time is it at 4 o&#39;clock? please do not reply,0.3182,positive
2016,४ bjye bhai bhai॥ come live now,0,neutral
2017,bhai 4 to bj gaye kah ho aap assalmu alya kum namaste sastrikal adab,0,neutral
2018,aaj ki pratiyya bhaijaan ki tarf se pb paar,0,neutral
2019,"bhai, your brother is in a state of peace, because i am not making a lot of money because of what i am talking about and i am proud to tell you that you will ask me what you want to do.",0.7845,positive
2020,i am from bangladesh. jaytur aange in mumbai,0,neutral
2021,oxallu 2 minutes,0,neutral
2022,hey how are you online,0,neutral
2023,see you again at sir jodhpur airport.,0,neutral
2024,pleas telly me bho salu mi ji,0,neutral
2025,sbk nhi malom meh hai dua hai,-0.0772,negative
2026,salmin alaykum salman khan jum bubarkho how are you,0,neutral
2027,४ bjnne hili is,0,neutral
2028,salmanbhai apvadio chatkro gya,0,neutral
2029,the bus is monotonous,0,neutral
2030,"please tell, whats the story of them big puppys ...........",0.3182,positive
2031,why talk about it,0,neutral
2032,just 1 min,0,neutral
2033,how did i know that you have come?,0,neutral
2034,slman plzzmm apse milna chahti hu.,0,neutral
2035,exclamatory,0,neutral
2036,1 min brother,0,neutral
2037,only take selfies with you,0,neutral
2038,you have to take a long time to see your face.,0,neutral
2039,aa jao bhaijan,0,neutral
2040,come on now,0,neutral
2041,he was looking very handsome and the baby was also very handsome. charming song. the fun was over. :) :) :),0.9731,positive
2042,held salmon.sir,0,neutral
2043,bajrangi bhaijan 1 stday 1 st showwjum man,0,neutral
2044,yes,0.4019,positive
2045,where did you live,0,neutral
2046,how are you bhajan? agely waiting fourteen,0,neutral
2047,has arrived,0,neutral
2048,भै 4 बजगये य्र्॥ once upon a time,0,neutral
2049,om is the second person,0,neutral
2050,had that pus come in arms,0,neutral
2051,plz come sir,0.0772,positive
2052,salme kamse kum3 moviye ki kro salman bhai,0,neutral
2053,hlv salman only.,0,neutral
2054,will you talk like that?,0.3612,positive
2055,i am waiting for him.,0,neutral
2056,salman mughe your exact subscription,0,neutral
2057,how will you talk like this?,0.3612,positive
2058,how can i help me with my love,0.7845,positive
2059,how do you do that? salman khan,0,neutral
2060,assalamu alaikum bhai,0,neutral
2061,om baje un abhi bhi bhi baadhi hai?,0,neutral
2062,everlasting men :-),0.3182,positive
2063,"at 4 o&#39;clock, however, sallu is still hungry",0,neutral
2064,come soon,0,neutral
2065,it's 4'o clock,0,neutral
2066,talk to you soon and keep up the good content,0.4404,positive
2067,please come soon,0.3182,positive
2068,allah is pleased with you,0.4404,positive
2069,1 min zyd hogya bhai aao na,0,neutral
2070,salman is alive. blessings are so bright. ॥,0.8516,positive
2071,4 p.m.,0,neutral
2072,om baje bhaijaan,0,neutral
2073,ok abmai j rahi hu byee.,0.296,positive
2074,om baje bhaijaan bhaijnji: - * &lt;3,0,neutral
2075,झ blazen only,0,neutral
2076,bjyye ४abj mere yaar,0,neutral
2077,4 bhajgye lekin salman bhai kider hai,0,neutral
2078,where are you,0,neutral
2079,salman,0,neutral
2080,where are you from?,0,neutral
2081,take your selfie and set it on the profile because salmon khanme kafi e&#39;dh.,0,neutral
2082,sooner or later,0,neutral
2083,hello brother,0,neutral
2084,"come on in, take a look",0,neutral
2085,"look, you are buzzed, then you too are in a hurry.",0,neutral
2086,४ badge bent,0,neutral
2087,4 p.m.,0,neutral
2088,where are you? ajao or intezer nehi hot,0,neutral
2089,४ but they are not happy.,-0.612,negative
2090,ply reply sir,0,neutral
2091,how are you,0,neutral
2092,४ bjed but bhaijaan&#39;s abhi is no more,-0.4215,negative
2093,bekkoof has become koi. salman is so free. joe chatney bathey. it is ok,0.7537,positive
2094,"what do you say, brother?",0,neutral
2095,please don&#39;t listen,0.3182,positive
2096,only 4 baja aayo no please,-0.2411,negative
2097,"many of them are from pakistan, sindh and karachi",0,neutral
2098,"if it is 4 o&#39;clock in india, if aplandon beth is not found.",0,neutral
2099,my life is only a dream. your sath ex selfie brother,0.25,positive
2100,hello salmon that..,0,neutral
2101,don&#39;t push too hard,-0.1027,negative
2102,kamal karte ho pandey ji vhr u,0,neutral
2103,bhai bhat nahi khene too maan krteye my khan ki bhatriya bhi lov ho gaya hai. :(,-0.4404,negative
2104,what are you saying ??,0,neutral
2105,"please tell, whats the story of them big puppys .....",0.3182,positive
2106,all will happen from people,0,neutral
2107,8 years old,0,neutral
2108,bhai gave fool to everyone hahahaha,-0.4404,negative
2109,help me that plan help me,0.6597,positive
2110,nai at kamin salman khan sabko pagal banar lolz,0.5719,positive
2111,bajra char,0,neutral
2112,his salmon i form margin we are love you boldly fan turkey love you love you come in turkey come in istanbul much?? you we salmon hair i love you much ?? you are films like? my favorite films choir choir couple couple ??,0.9819,positive
2113,yrsalu bhai jaldi idhr pkmloadshafing hojegi: d,0,neutral
2114,brother,0,neutral
2115,avi aap aajon plz,0.0772,positive
2116,"brother, there is nothing wrong",0.3724,positive
2117,when will you come,0,neutral
2118,is it ok,0.296,positive
2119,that.post ply,0,neutral
2120,bajrang bali ki jai,0,neutral
2121,it&#39;s almost 4 o&#39;clock in the morning.,0,neutral
2122,it&#39;s 4 o&#39;clock,0,neutral
2123,how are you going to talk to salman?,0,neutral
2124,i don&#39;t care about my brother. the true life is here for you.,0.7184,positive
2125,brother pls will do it,0.0772,positive
2126,"४ buzz, but you are absent",0,neutral
2127,it's pm sir,0,neutral
2128,why are you doing bhaijan frank come soon,0,neutral
2129,salman bhai mri bfmjse jad apko pyaar karti ha.,0,neutral
2130,sallu bhajan.pls aa jo ab,0,neutral
2131,bhajrangi bhaijan ooffi c eal paige jao baat karna ke,0,neutral
2132,why will you roll,0,neutral
2133,bhai aaj ki paritye yeh songe film dikao na plaisse,0,neutral
2134,once upon a time there was no such thing as a self-fulfilling prophecy! ;-),-0.126,negative
2135,त्यम् क्ब्क हो ग्य॥व्ह्र् र् उ,0,neutral
2136,the case is still going on,0,neutral
2137,you need more than luck to succeed in affiliate business,0.7564,positive
2138,right now,0,neutral
2139,"apj aqui film miss nehi kart, kisak film klia theatre jau ya na jau. 2-3 minutes. you need javascript enabled to view it.",-0.1531,negative
2140,"come on, come on",0,neutral
2141,arya yar koi tohbo bolo subment kare khali kispe baat karinge bhi,0,neutral
2142,is that 4 times more than rs ??,0,neutral
2143,which song do you like the most from sallu bhaijan&#39;s film #bajrangibhaijan ?? ??,0.5362,positive
2144,om bajaay bhai aab too aao na ples,0,neutral
2145,salman only please do not tell hum plum to play,0.5719,positive
2146,why are you making fun of bjrangi bhai,0.5106,positive
2147,salman bhai kaha hai,0,neutral
2148,kya baath hai meri dost kya aapare do film with me,0,neutral
2149,you&#39;re a real spit fire and that&#39;s exactly what we like on this site cc!,0.1007,positive
2150,"lowe u vaijan, you always have your own entertainment man",0.5106,positive
2151,4 is pmsalmankh,0,neutral
2152,sree jee 2 mantra kranti lyal liyaab itne d apko jaya baat krani.,0,neutral
2153,salman time pur hogya ajo na fbpe,0,neutral
2154,etz0.02 pm,0,neutral
2155,"plus, you&#39;ll be getting rid of clutter you don&#39;t need",0,neutral
2156,"yes, everyone is crazy",0.0772,positive
2157,"hey musk, why are you dying?",0,neutral
2158,ziyad apko kirt ho,0,neutral
2159,"hello, someone?",0,neutral
2160,indo k7 bjyyk pq k bj;),0,neutral
2161,or far football ?,0,neutral
2162,"bhai is settled on his own heart, but it will come",0.3818,positive
2163,hello bad brother,-0.5423,negative
2164,sallu is asleep. are you gone,0,neutral
2165,abe it is a real opinion of the koi salman,0,neutral
2166,बेइन्ग्सल्मन्खन्॥ ka ha ho yrr iaytoh sahi :),0.6597,positive
2167,but now the beautiful image has been sold out.,0.7469,positive
2168,1 play only plan,0.34,positive
2169,let&#39;s get started,0,neutral
2170,where are you,0,neutral
2171,how much else,0,neutral
2172,only buzzed,0,neutral
2173,sallu bhai mer tharfse ramzan mubarak ho,0,neutral
2174,where are you,0,neutral
2175,सिर्र्खन् हो॥गोलि तोह्नि दे रे ??,0,neutral
2176,where is it,0,neutral
2177,it's 4.3 pm,0,neutral
2178,"what do you do, salman?",0,neutral
2179,i have come sooner than ever. &#39;(:&#39; (: &#39;),0.4939,positive
2180,"well, the profile is good",0.6124,positive
2181,et: 03: 3,0,neutral
2182,it&#39;s 4 o&#39;clock,0,neutral
2183,it is salmon,0,neutral
2184,biryan achi chilli yahin in bhopal,0,neutral
2185,om baje bhaijaan,0,neutral
2186,why do you worship? ;),0.4767,positive
2187,ज् been but salmanji did not come. : /,0,neutral
2188,4 o&#39;clock but still gone,0,neutral
2189,"it&#39;s 4 o&#39;clock, but it&#39;s too late.",0,neutral
2190,hello sergey,0,neutral
2191,we will not be able to answer the question,0,neutral
2192,someone made fun of me,0.5106,positive
2193,do i have a choice?,0,neutral
2194,"please tell, whats the story of them big puppys .....",0.3182,positive
2195,४ bajj gaye but sallu santri ki antriya abi hai,0,neutral
2196,come on,0,neutral
2197,bajrangi bhai dargaye is idde me lagta hai,0,neutral
2198,e hope appreciation jr. kroge.,0.7351,positive
2199,"come on in, take a look",0,neutral
2200,bhaijaan your driving license is not bad ??,0.4956,positive
2201,chili and samosa khilao are very popular,0.4754,positive
2202,please be with me first,0.3182,positive
2203,hey vetro is definitely not,0.4019,positive
2204,only how will you find the answer ;-(,0,neutral
2205,it will be 5: 5,0,neutral
2206,every see. 300 pp cent,0,neutral
2207,sir ply ply,0,neutral
2208,ek nevstatus baat karte hai hai;),0,neutral
2209,om baje bhai,0,neutral
2210,bs refresh kr jh hu who repli nah ah bhai ki,-0.1027,negative
2211,salman bhai zind badar and his friend dosuman mordabad,0.4939,positive
2212,4: 2 is where are you ?? may i say that you are there ??,0,neutral
2213,hi salman,0,neutral
2214,"come on, don&#39;t hurry, who cares about you?",0.4588,positive
2215,only you will get upset,-0.3818,negative
2216,who are you going to talk to me?,0,neutral
2217,where are you brother,0,neutral
2218,om baje gayab to aajo mere bhai :-(,-0.3612,negative
2219,brother,0,neutral
2220,nay ayyar,0,neutral
2221,b ho tu bhaijan,0,neutral
2222,what happened,0,neutral
2223,"hello sallu, how are you? i love you :)",0.802,positive
2224,४ but they are still angry;),-0.6652,negative
2225,4:04 over,0,neutral
2226,why are you talking?,0,neutral
2227,what will you do bro?,0,neutral
2228,bhai vork hai kya hai hai bhi hai thodi dar baad buat plzzz tutien jana hai,0,neutral
2229,we&#39;ve got a lot of work to do :),0.4588,positive
2230,array kmal krtey ho humsbvait krhey ha,0.34,positive
2231,what time is it?,0,neutral
2232,will you be able to do it again?,0,neutral
2233,you are right,0,neutral
2234,"from your childhood onwards, your best friend will not be able to reply to you today. you will be happy today. अ c च रेह्त ॥थन्कु",0.9022,positive
2235,jug in last 5 mints.. 500 comments and 100 likes.. it jug assume,0.4215,positive
2236,"salman, you are seeing how many fans are waiting for you. just say hello to everyone.",0,neutral
2237,sirji will not talk now,0,neutral
2238,i swear to you,-0.0516,negative
2239,salman only please come here,0.3182,positive
2240,what do you think? come soon,0,neutral
2241,४ but i have not come yet.,0,neutral
2242,salman khan meeting bj hey he will come to online,0,neutral
2243,om bajj hai salman,0,neutral
2244,"please don&#39;t ever come to mathur, this is a day full of your days.",0.3182,positive
2245,salmon ply cm?,0,neutral
2246,where have you been?,0,neutral
2247,hmmmtum hare agayi hussalman: *: *,0.4404,positive
2248,how are you doing with katrin,0,neutral
2249,please do not talk to me,0.3182,positive
2250,"hey, only for you, there is a fourth world. ;)",0.2263,positive
2251,it's 4:02 sir,0,neutral
2252,"brother, the eagle is paid, everyone is unaccounted for",0,neutral
2253,"what happened, bhaijaan?",0,neutral
2254,sayed app bussy ho,0,neutral
2255,ya bajj gaye bhairapply,0,neutral
2256,that&#39;s right,0,neutral
2257,dabangg 3? constipation,0,neutral
2258,say yes brother ??,0.4696,positive
2259,"don&#39;t tell me, i have 3 questions from myself",0,neutral
2260,i am waiting for 4 4,0,neutral
2261,"please tell, whats the story of them big puppys ..... 918399840411",0.3182,positive
2262,how about crange or // quick fub! in tel,0,neutral
2263,"brother, i am not making foals.",0,neutral
2264,hello 4 mint,0,neutral
2265,"it seems that salman is self-sufficient, we do not have it?",0,neutral
2266,where are you all?,0,neutral
2267,at 5 o&#39;clock in the morning to speak,0,neutral
2268,it was 4 o&#39;clock in india,0,neutral
2269,how are you,0,neutral
2270,come on,0,neutral
2271,what are you saying that you are?,0,neutral
2272,he died and died,-0.802,negative
