,ENGLISH_TRANSLATION,SCORE,SENTIMENT_LABEL
668,"as long as you pay your dues, you will become a millionaire.",-0.1027,negative
669,"if you have any questions, please feel free to contact me.",0.6808,positive
670,salman ji wants to meet you once in his envelope. i want to talk to you. thank you so much for the people who help you. your mary is also old,0.6705,positive
671,your name&#39;s name is not strong,-0.4023,negative
672,sir..pus visit to kanpur once..pass.,0,neutral
673,salman rayoly goodyar,0,neutral
674,the flashes of the book are all gone. i&#39;m a superhero.,0,neutral
675,"when the person is irresponsible, then he calls his master. when he feels slight, he begins to feel his fault.",-0.6808,negative
676,bet salmon khbister film flophog bee suar,0,neutral
677,plz c al sallu bhai bangladesh bigfnme plz c al +880171944771 jai ho,0.1531,positive
678,"if you are a muslim, you have become a disbeliever by becoming a muslim.",0,neutral
679,are you still awake everyone?,0,neutral
680,"lowe&#39;s zend a torvo, who is a self-proclaimed holocaust survivor, is not a sixteen-year-old.",0.3612,positive
681,ajatpavar is nevs conscious,0,neutral
682,we will not call you or we will go for entertainment,0.4215,positive
683,thu thu thu kuttey.,0,neutral
684,सल्मन् खन् देस्त् अ c तर् बोल्ल्य्वोओद्,0,neutral
685,"handsome is my brother, brother!",0.5411,positive
686,"this is how you are, your fan",0.3182,positive
687,"friends, your heart is a wonderful feeling",0.91,positive
688,salmon is very good,0.4927,positive
689,very very very very very very very very very very very very very very very very nice and i love up that japan,0.8332,positive
690,don&#39;t feel free,0.5106,positive
691,idoit salman is a muslim.,0,neutral
692,"what did you do, who would give so many bad c omnations, why would they leave?",-0.6096,negative
693,salmon khan rock's is,0,neutral
694,merriya ki opreatiyan hai app ki madat melag,0,neutral
695,it is very good,0.4927,positive
696,nispai salmanbhai apne to sabko diwan ban rakh hai,-0.5574,negative
697,"as a matter of fact, my jan salman khan",0.0258,positive
698,my good friend,0.7269,positive
699,masat hai bahi,0,neutral
700,hey mericute,0,neutral
701,"and even if you know it, you know it is yours.",0,neutral
702,sale told musalmano that without you hitta karunga,0,neutral
703,salmon dead,-0.6486,negative
704,"this will be super superior, so no one to cry",0.4228,positive
705,it is good,0.4404,positive
706,ku salmanka nambin him kamnhi hot kyam bhai logo,0,neutral
707,dog is alive,0.3818,positive
708,those who call others filthy are themselves,0,neutral
709,what are you saying,0,neutral
710,bhadra hai sal,0,neutral
711,"jobs are a must have, for any affiliate, promoting any program.",0.3612,positive
712,that or evergreen,0,neutral
713,please be my friend,0.6705,positive
714,my only dream is that i will meet you in salman only in expo.,0.25,positive
715,bajrangi bhaijan ekno.,0,neutral
716,"akbarudin owsi is a true muslim, and you are in the name of musalmano",0.4215,positive
717,salman khan fansi gandu,0,neutral
718,mercury is salman khan,0,neutral
719,de ter and salman ki char te ter hisa is chip,0,neutral
720,salmon bhai me apki boohatbari fannh.,0,neutral
721,"what do you think of yourself? you give a shit to muslims. now look, there are very few muslims.",-0.5574,negative
722,"if you are giving challange to muslims, then why do you fill the movie with jholi vali kavali ??",0.4137,positive
723,"that sugarcane is going to be all for me, i heard",0,neutral
724,mr. lowe salmanchallenge bhi good of chalangange deal and bhi good,0.743,positive
725,salman khan bet hero in the us,0.5574,positive
726,you are right,0,neutral
727,do not look,0,neutral
728,"brother, you do not feel that karen has used the bhot zyvid. #salmankhan",0,neutral
729,i have to marry someone,0,neutral
730,"god bless you, god bless you, god bless you, god bless you, god bless you, god bless you, god bless you, god bless you, god bless you, god bless you, god bless you.",0.9927,positive
731,who is muslim? your people know that it is 4 give it to god,0.2732,positive
732,any france?,0,neutral
733,bhai aps bajrangi bhajan movi song vereyni,0,neutral
734,haram kutt sal lant ho tujpar,0,neutral
735,teri film flop hogi dekhoo ab salman khan,-0.34,negative
736,hi sallu bhai &lt;3,0,neutral
737,"friends, don&#39;t watch this movie",0.4767,positive
738,chloe becomes a new friend,0.4939,positive
739,it should have been a song,0,neutral
740,hello salman only,0,neutral
741,hello 22 jan.,0,neutral
742,don&#39;t be silly.,0.0258,positive
743,bhai salman bhai,0,neutral
744,assalmolay kumwai,0,neutral
745,teri okat kya hai khabbis which is good to hum musalmano,0.4404,positive
746,सल्मन् भै अस्लमोलिकुम्॥,0,neutral
747,stay away from the world,0,neutral
748,salman khan is the only one listening to you,0,neutral
749,is salman replying to your omnipotent method or not?,0,neutral
750,"if you want to become chuti salman khan, then first become shahrukh",0.0772,positive
751,say no to the peace of peace of the muslim world,0.7003,positive
752,"in the world, which is the best, then we are always only that o is the only sun",0.6369,positive
753,bhekari has come to take a second flight with the help of eid.,0.4019,positive
754,hai salman bhai,0,neutral
755,i am very much my friend in salman,0.5367,positive
756,"if you have some knowledge in delhi, you do not understand the rules of not being able to do such kind of work",0,neutral
757,gud morning bhaijan,0,neutral
758,you are wrong and i am happy,0.1531,positive
759,"salman khan said that maqi chit uski maqi chutme modi&#39;s sal salam open the year of birth, that it is born that the land of the lord is in the nakli, that is chenal randi madarchod",0,neutral
760,love love love,0.9274,positive
761,hanbro rose is a relief,0.4767,positive
762,"chutiya no 18 who can not believe in himself, who cannot do anything, nor do people who do not love themselves or whom do not love anyone?",-0.8375,negative
763,i don&#39;t look as good as you but i&#39;m good as you,0.7003,positive
764,"neither did you love me nor do you want to be sad, but you do not want to be jealous, nor do you meet me while you are lying, but you are deceived",-0.9526,negative
765,bbm did not forget what he had done and did not do it for the sake of america,0.1695,positive
766,vidya gupta is mad.,-0.4939,negative
767,mujhāya ishātāk is the fact that you are muslim.,0,neutral
768,he salman only lowe u pizz exur muj se bata ko pir piz piz piz,0.128,positive
769,"if your film is super, then go to bajrangi",0.5994,positive
770,नै c ए नै c ए नै c ए॥,0,neutral
771,those who are filthy will remain filthy.,0,neutral
772,love you &lt;3 &lt;3 &lt;3,0.6369,positive
773,salman vai pls kept his rate.,0.0772,positive
774,oye tu qi badi baatee karte hari why be mad?,-0.4939,negative
775,assalamu alaikum salman khanhum wants your fans to come to you at the age of twelve. may allah make your envelope easier. ameen.,0.4215,positive
776,salman g agar yeh msg dekho hoto replace play plays,0.5267,positive
777,are you looking at your husband or sister?,0,neutral
778,"this is the kind of love that i would get from a person, so if i do it in the omentum, so that they will be able to live in their own house.",0.6003,positive
779,love u samoan khan i love u so much mithuu..mmuuaahh,0.8555,positive
780,"you are made of a type of clay, you have a word from 3.5 to 3.5.",0,neutral
781,i have written all my orders in this regard.,0,neutral
782,who was pantentu pe pantingu acha tha,0,neutral
783,"if there is a dog, neither a muslim nor a hindu",0,neutral
784,give and give to people,0,neutral
785,butsalman wants to do the same,0,neutral
786,it seemed to fall,0,neutral
787,koun bolt hai saadi will not be ameri and salman will be saadi 2014,0,neutral
788,"speaking of janmeko, i am in love with my god in any trouble",0.5574,positive
789,"may the people who hurry me be quicker than i am, be dejected",-0.4939,negative
790,salmon handsome king,0.4939,positive
791,my wife will be happy with whom we have come from the show.,0.5719,positive
792,salman fans addme &lt;3,0,neutral
793,who will send me rake,0,neutral
794,salman khan is a new dog in bollywood,0,neutral
795,sidhi vinayak ganesh zi jai ho,0,neutral
796,kutta harmi madar chod bighrat salmanto agar maje miljai teri ma vin ek kardong,0,neutral
797,salman khan ji kasya ho your ayad paar who is moivhee hai tekhe pa ne naam tey ne hai mar msg daklan g oak,0,neutral
798,you smile,0.3612,positive
799,hi sallumey eid mubark ho,0,neutral
800,salmon my family,0,neutral
801,"salman khan does not like your name, it is not necessary to give the name of a muslim, which is so bad, the islamic religion is not necessary to give you islam.",-0.7651,negative
802,i have kept alreyaad bol for me,0,neutral
803,i just want to meet my brother-in-law,0.0772,positive
804,"kalakshmi believes that there will be arti when subha, namasti ji",0,neutral
805,the one who is mistaken will be numb,-0.5994,negative
806,ami salman&#39;s vallobisi lowe u salman,0.128,positive
807,no. dijia whatsapp&#39;s photo beige,0,neutral
808,do you become a film of mine,0,neutral
809,talk about,0,neutral
810,may allah bless you from all sides,0.4215,positive
811,hello salman.,0,neutral
812,"if you have any questions, please feel free to contact us.",0.6808,positive
813,hi salmon i'm same bloch in balochistan i'm big fan of you,0.3182,positive
814,very dirty,-0.4927,negative
815,bajrangi weir son dalde,0,neutral
816,love too or very hands,0.6369,positive
817,this is not a good idea for the ex-officio formulas and shortcuts.,-0.3412,negative
818,will you have self-control?,0,neutral
819,such a long speck of kuchmi would only be 2 years old and their gold would not be enough. sekho e love you sallu ??,0.6767,positive
820,the worst is yet to come,-0.6249,negative
821,how do i look at the speed in the world?,0,neutral
822,it looks like 24-25.,0.3612,positive
823,"hello, just how are you happy?",0.5719,positive
824,poets come only on the oasis.,0,neutral
825,tell me soon,0,neutral
826,listen to bhajjan&#39;s kolkata,0,neutral
827,aslam goes a little farther,0,neutral
828,this is the lesson to be learned,0,neutral
829,bollywood king my brow salmon khan,0,neutral
830,bajrangi bhaijan sabre c ord todegi salman bhai ji,0,neutral
831,what should salman do to meet each other?,0,neutral
832,"please know. once you have a chance to do something, you have to do it. this life is the worst of all",-0.2023,negative
833,i love you,0.6369,positive
834,that is why they came to help everyone in ramadan,0.4019,positive
835,"350 c kamati ab,",0,neutral
836,"got fixed due to constipation, come soon!",0,neutral
837,"salman ji, we will definitely see you today on the 17th of july.",0.4019,positive
838,"yes, tonight",0.4019,positive
839,"if you have any questions, please feel free to contact me. अभि फौरन्॥",0.6808,positive
840,he loves his husband for his husband,0.5719,positive
841,aid k bin salman khan said that mowei flopkshyak kumar ko mowehi jab raleyase is interested.,0.4019,positive
842,yes my cut salmon,0.1531,positive
843,"if you have any questions, please feel free to contact me",0.6808,positive
844,"please don&#39;t relay your movie 27 ramzan. in this case, the 27th day (holly night) is considered to be the best of the best. all muslims are worshipers. you are not a muslim. #beingsalmankhan #bthisaid #ajkiparty #bajrangivajan",0.9118,positive
845,"if you want, try me today",0.0772,positive
846,"you are very rich, we want to return to you, but those who do not care about you, like my friend, need your help, and if you are returning, please help her.",0.9508,positive
847,"if you have any questions, please feel free to contact us.",0.6808,positive
848,hey salmon sir if my c oment ko padham to plz ekbar reply karna,0.0772,positive
849,why are some muslims so angry with salman?,-0.6418,negative
850,pehle roje to bikh le fide aid manan,0,neutral
851,"absolutely higher than the net, you have been sent to brangri for your songs. 4",0,neutral
852,why don&#39;t you say your name or you come,0,neutral
853,we do not support the betrayal of the nation,0.2057,positive
854,excavation cloe plz plz from salman ki deewani mujh,0.1531,positive
855,"soory man, who is a master man?",0,neutral
856,congratulations on behalf of movie flop humbus,0.3612,positive
857,do not talk to me,0,neutral
858,"because we are not ready to do so for the sake of response, because the invitations are only for brothers and sisters.",-0.2755,negative
859,"no one will be able to watch such a movie after ibadat, which is hanuman chalis padha.",-0.296,negative
860,â € ž j &#39;å&#39; business â € ¹ business â € â € ˜â¤ is ready,0.3612,positive
861,"i will not see this movie, but i will not see it",0,neutral
862,"anyway, at least i didn&#39;t go down without explaining myself first",0,neutral
863,talk to you soon and keep up the good content.,0.4404,positive
864,bigbrother pertde de orye chot bhai pertye mein aaye ho aase ho sakta hai ky kvi # salu bhai (bajrangi bhajan),0,neutral
865,"brother, i can save myself with you",0.4939,positive
866,hell dog,-0.6808,negative
867,"if you are an apprentice, then think about it before the sun is not there;",0,neutral
868,lovely sallu bhajine,0.5859,positive
869,why is it iftar duty?,0,neutral
870,"no matter how happy you are, you are still happy",0.8088,positive
871,i will go to see the stories of my own stories when i have said that my movies are different than those of musalmano,0,neutral
872,with respect,0.4767,positive
873,kiski pratyav bevakoff badtmeez,0,neutral
874,salman ab hindu hindus hey bhayao koi mowiye dakhne nahi,0,neutral
875,exquisite,0,neutral
876,"well, this news is rumored to be circulating among muslims",0.2732,positive
877,super duper floppinshallah nich hai salman khan 4?,0.5994,positive
878,it is too late to prepare.,0,neutral
879,tum.,0,neutral
880,anyone who watches this dog movie will not be a true muslim,-0.3252,negative
881,ha bhai ho ho gyi patya aaj ki,0.34,positive
882,"today, klod is starving to death in his father&#39;s house",-0.7717,negative
883,i&#39;m ready,0.3612,positive
884,teri patrati tere bab ko na lyaank,0,neutral
885,how are you,0,neutral
886,why do i want to do something in my house?,0.0772,positive
887,"khanbole tho salman khan, diltadpar bhaijan ke liye",0,neutral
888,bhai apne bol aur main c omment mar diaaaid mubarak ho,0,neutral
889,what will happen to him?,0,neutral
890,pay me b hogs party with salmon:(,0.3182,positive
891,plz in the movie of salman bhai esongs,0.0772,positive
892,"salman is there, i am my favorite.",0.4588,positive
893,who is happy about you?,0.5719,positive
894,"who are you saying, which person is there, who is coming and who is coming",0,neutral
895,i thought i was going to win a good song,0.7717,positive
896,sal kutt ter movi kon dekha haram,0,neutral
897,greetings to salman bhai ji. this eid is superhero. jai bajrangbali.,0.4215,positive
898,very very very very very nice,0.5625,positive
899,eid mubarak bajrangi bhijan,0,neutral
900,love you salmon,0.6369,positive
901,"yes, that&#39;s right you can now become known as a lord of the rings",0.4019,positive
902,how do i listen to this song?,0,neutral
903,osm perty salman bhai apk gift,0.4404,positive
904,no muslim should see this,-0.296,negative
905,masthabhai ekno 1.,0,neutral
906,"one thing is for sure. # सल्मन्_भै॥ i don&#39;t want to talk to you, but i don&#39;t want to talk to you.",0.3071,positive
907,ramzan and aid bahut bahubat mubarak ho i lowe u,0.128,positive
908,yeh toh janb kehte hai ke ben musalmano ke film hitkar karkar se dekha,0,neutral
909,ramdan mubarak salu bhi 4,0,neutral
910,lubboo sallu,0,neutral
911,this film is all set to be flopped and next which will be a sub-flop and you will get a glimpse of what it is like,0.3612,positive
912,"o jahnami,.",0,neutral
913,it is colorful. ॥,0,neutral
914,all muslims have passed through the book and it is said that it comes in ramadan and not in the next ramadan.,0,neutral
915,allah ke naam behurmati ki tune salman,0,neutral
916,kal dajjal hai salman khan,0,neutral
917,jai jai bajrang bali sallu bhai eknumber,0,neutral
918,the sun is beautiful!,0.636,positive
919,may allah keep your desires safe,0.4404,positive
920,"brother, it is good that there is good fortune.",0.7003,positive
921,"i love you, i love you, i love you, i love you, i love you, i love you.",0.9803,positive
922,"yeah al that sounds pretty crap to me, looks like bt aint for me either.",0.6486,positive
923,salman ki bandh jani chahiye isbar,0,neutral
924,look at this movie.,0,neutral
925,oo salmansle ku bohat ghamand ayi musalmano ku bol kee musalman koi bi nahi dekhe tho bi chalegi meri movie bolke bol,0,neutral
926,isliye ye salman koothe film koy ko musalman math dekho,0,neutral
927,sllam bhai jaan edmubarakh.,0,neutral
928,un dholom machke jana in her sal eid,0,neutral
929,i need to come,0,neutral
930,from here on behalf of each other,0,neutral
931,bhakutiya sal bhosrdi kar garat naam koi ki chizhni kya re tujme,0,neutral
932,why did ali see zain ??,0,neutral
933,what is the name of a muslim? what is the name of a muslim?,0,neutral
934,"yes, that&#39;s right you can now become known as a lord of the rings",0.4019,positive
935,let&#39;s see how release kareg moved,0,neutral
936,silent bath,0,neutral
937,iski ma choddo salman ki,0,neutral
938,"the name of sal musalman is a stigma that it has been done for the muslims, but the person who is doing it, is living sooner than him.",0,neutral
939,kuttya sharam toe hai ni tujh maa zillill man,0,neutral
940,no one is religious,-0.296,negative
941,say hello to god against the goddess of god,0.4939,positive
942,you are mine,0,neutral
943,"hello, why are you my friend? run away with a lot of chants. no c ** d",0.25,positive
944,tumke ke fairlh se daro salman id maz lelo akhirat mein mantra tpp mareg,0,neutral
945,this bhosdivale bhagne ki nh bm mc haram sele suvar ki olad,0.4939,positive
946,eid ki pratya kahpe milu bhai,0,neutral
947,you are very smart and you are very smart.,0.7172,positive
948,bhaijaan aid mubarak,0,neutral
949,thanks alotsallu,0.4404,positive
950,chor hai madarchod salman,0,neutral
951,no one will see you,-0.296,negative
952,salman khan is less in the name of hindu muslim shame॥,0,neutral
953,brother aid&#39;s gift will be given,0.4404,positive
954,"if you are a true muslim, then watch this movie on eid day.",0.4215,positive
955,"this is the time with respect, when our iman azmay will live",0.4767,positive
956,i will not watch your movie in disbelief.,0,neutral
957,"by the way, we have also done this, but we often used to stay here.",0,neutral
958,"salman bhai, i am also",0,neutral
959,what is it that you say,0,neutral
960,"yours too will be justice. if it is not, then it will be hong. . inshallah",0.5267,positive
961,sandhya slman will do the same,0,neutral
962,alish sallu was about to come. stop dreaming,-0.296,negative
963,or who are the indians who are the muslims and who are the muslims themselves?,0,neutral
964,take this picture and tie it up in bathroome,0,neutral
965,sallu isbst,0,neutral
966,brother is born,0,neutral
967,"salman, i have a lot of answers for you.",0,neutral
968,it is because of the muslims that you have to look at yourself before speaking to the lower muslims. samg. threatens us to see who wants to move this century,-0.5859,negative
969,weat karna padeg,0,neutral
970,"be aware of your heart, but you are apart from this world, you have to be happy with the world from the heart of the world.",0.9377,positive
971,"if there is an unfamiliar title with a muslim, it is not possible to give it to him.",0,neutral
972,you will remember so much love,0.6682,positive
973,abhi aaswariya ki bhut utar hai ni hai to tumko kaha mete,0,neutral
974,tu dill hai tu jaan hamer hamar salman hai,0,neutral
975,o ji gashti ke bachaye musalman ho ki hindu bn han lant tere pe,0,neutral
976,teri patti tujhe mubarak humare liye allah kafi hai,0,neutral
977,i am sure that bajrangi bhaijan movie will be flop,-0.0258,negative
978,bajrangi movie will flop salman ki. i am a sister-in-law,-0.34,negative
979,abki baat 800c r par bajrangi bhajan (y),0,neutral
980,some song bhaijan..,0,neutral
981,"yes, i love you.",0.7845,positive
982,who is your only self?,0,neutral
983,lant ho bajrangi shaitan par lanti sliman,0,neutral
984,i want too,0.0772,positive
985,flop movie gutta salmon,-0.34,negative
986,"yes, i&#39;m sorry, god save you from the evil eye.",0.3182,positive
987,"salman, you are blessed by allah. he who speaks harshly, his house is full of thorns (thats means haram khor k khandan).",0.5994,positive
988,what is eid? this is what happens when a movie is released.,0,neutral
989,it is there,0,neutral
990,"eid mubarak be salman g. i pray to you, that you may be very good, like your heart.",0.9095,positive
991,"in your movie, you have to talk like this.",0.3612,positive
992,there is no such thing as a superhero.,-0.296,negative
993,"on the day of eid, salman kissed his mother",0.3818,positive
994,everyone knows salman khan.,0,neutral
995,"otherwise, it will not be as easy as it is thought to be.",-0.3412,negative
996,yes,0.4019,positive
997,my sally brow always mindblowing slam sally that,-0.3818,negative
998,ishtar eid&#39;s name is from that,0,neutral
999,"i&#39;m sorry to hear that, but i&#39;m sorry to hear that.",-0.1531,negative
1000,salman khan teri film flop jayegi tu musalman nhi hutu kafir ha,0,neutral
1001,there will always be movies in the box office that will always be happy with your films.,0.5719,positive
1002,amazng bhaijaan lowe ooh koi kuch ke le me toh 1 st day 1 shove jong 4,0.128,positive
1003,salman khan ek achhe action hai meri bhai hai,0,neutral
1004,"if you have any questions, please feel free to contact us.",0.6808,positive
1005,aid mubarak bhaijan in advanca,0,neutral
1006,party to tax hogs jaw life mein pretty hogs and pretty life hogs and pretty hi my beloved wife hogs,0.9393,positive
1007,"this is what kamin salman is talking about, not maksood",0,neutral
1008,pirtya toh apk sath karni thi boss,0,neutral
1009,ramadan or eid mubarak ho salman bhai 8863960135,0,neutral
1010,we are always ready. just your arrival is delayed. ;-),0.3818,positive
1011,oui salman khan,0,neutral
1012,"come to your poet, our oris",0,neutral
1013,"i really like salman, i don&#39;t like him very much.",0.6478,positive
1014,"i love you so much that i have your own brochure, you can kiss me, i will kiss you, i will kiss you, i will kiss you.",0.9371,positive
1015,sallu bhai ilove you,0,neutral
1016,"brother festival, brother is there, you are hummer",0.4939,positive
1017,salman tum bashram ho pahl namke matlab janlo pir samjo gai,0,neutral
1018,"you are not happy, but you do not want anything, it is bad after few days.",-0.7954,negative
1019,only in my big big bhu fun mujh apse c alk b ut karni hai exer sar mere c oont ck num 033585501313 skpe i d abdul.,0.5106,positive
1020,follow the logo of all religions,0,neutral
1021,ishtar bjp dog is a blot on a muslim,0,neutral
1022,speak this dog,0,neutral
1023,this is what everyone wants humlade and you are doing.,0,neutral
1024,why is ashu singhu born,0,neutral
1025,impure bros. . .,0,neutral
1026,"if you need an idol for worshiping god, then why do you need such a big mosque?",0.4767,positive
1027,abdull raheem bhai iske nahi aayen mu bhaat hai sal manres toh hai nhi isme isko sangjhan khade been bajan,0,neutral
1028,ashu sinh tumhari saat hoav hoge thou temple,0,neutral
1029,bhupendra panwar abtum mojsai is asking who i am,0,neutral
1030,this is not the case. plz bs kryr. . speak so nonsense,-0.5738,negative
1031,ashu singh tumhari baat hai samag nahi arhi,0,neutral
1032,abhi tak to bad dumt tum lodo hai ?? got freaked out?,-0.7383,negative
1033,@ bhupendra panwaritu pakistin qi ni chalat jat,0,neutral
1034,"abey pakistani dog, your hindi is also correct",0,neutral
1035,and from the strings of her heart,0.6369,positive
1036,"if you are a muslim, then you are a great thinker.",0.6249,positive
1037,and whatever is said in silence,0,neutral
1038,sonya khan is ex-muslim,0,neutral
1039,sonya you are a boy or a friend of a hurry,0.4939,positive
1040,"musselman is always a warrior in the same way as a hindu, look at the muslim muslim country.",0,neutral
1041,bhupendra panwar is a hijra muslim,0,neutral
1042,"bhupender bro is right, i haven&#39;t seen it in my life since then.",0,neutral
1043,अद्वेन् c एद् इद्द् मुबरक,0,neutral
1044,today is the day of salvation,0,neutral
1045,kuch lelungi for you,0,neutral
1046,i want to see gray singh or salman khan jodi xath,0.0772,positive
1047,and the case is in progress,0.4215,positive
1048,lowe o shallu,0.128,positive
1049,this is bajrangi. ॥ salmon,0,neutral
1050,"you know, plz 1 brc allya msgtu hut bol tha like y c omento karo tumpadyat ho na.",0.4215,positive
1051,a harem hai iski bhadw ki mowm mt dekne,0,neutral
1052,"before you call someone harmi, sleep in your neighborhood.",0,neutral
1053,salman khan bajrangi kutta ma ka loud venchod,0,neutral
1054,"i think i would like to have an app, please.",0.5859,positive
1055,"if someone is more than me, then the first show of this film is shove dekhe koi toh aadde mein",0,neutral
1056,how long will it take you to show up at the end of the show?,0,neutral
1057,"see the film in this dog, why are you taking your money everywhere",0,neutral
1058,hanji pazhi tiyar aa joob,0,neutral
1059,"i want to work with you, i want to do your homework, please take me to mumbai, please.",0.6369,positive
1060,you mujhe mssg kya th plz batao placee,0.0772,positive
1061,"there is a life of the whole child, why look at such a place.",0,neutral
